{"type":"interaction","version":1,"id":"environment-must-support-state-transition","status":"PROVISIONAL","source_ids":["environmental-causal-trace"],"target_ids":["recurring-landmark-narrative-mutation"],"relationship":"REQUIRES","conditions":["Parent and successor room states are separately authored.","Every added, removed, damaged, moved, or activated element has a compatible cause.","Unchanged identity anchors remain recognizable."],"effect":"The player can compare the place across time and infer consequence instead of seeing an arbitrary reskin.","failure_boundary":"If a successor room cannot be derived from its parent plus declared events, the mutation contradicts the world's history.","evidence":[],"supersedes":null,"updated":"2026-08-11"}
