{"type":"interaction","version":1,"id":"knockout-state-requires-collection-identity","status":"OBSERVED","source_ids":["reward-pool-progression"],"target_ids":["collection-ledger-completion"],"relationship":"REQUIRES","conditions":["A reward pool prioritizes undiscovered items.","Discovery is persistent across completions."],"effect":"The pool removes only identities that the durable collection state proves discovered under the declared reward set.","failure_boundary":"The relation fails when ownership and knockout state disagree, pool revisions silently erase progress, or variants are conflated without a declared identity rule.","evidence":["destiny-reward-economy-analysis"],"supersedes":null,"updated":"2026-08-11"}
