{"type":"interaction","version":1,"id":"lighting-and-audio-preserve-uncertainty","status":"OBSERVED","source_ids":["attention-and-uncertainty-lighting","spatial-information-audio"],"target_ids":["tension-pacing-balances-exploration","learnable-secret-language"],"relationship":"STRENGTHENS","conditions":["Observable cues identify possibilities rather than guarantee hidden state.","Critical threats and routes remain perceivable through supported alternatives.","Quiet and light do not logically prove safety."],"effect":"Players can form cautious hypotheses from the environment while fear remains rooted in incomplete but fair information.","failure_boundary":"If darkness or silence makes required information unavailable, the system is obscure; if every cue proves the answer, uncertainty collapses.","evidence":["https://www.ea.com/en-gb/inside-ea/news/inside-dead-space-4-the-intensity-director"],"supersedes":null,"updated":"2026-08-11"}
