{"type":"interaction","version":1,"id":"difficulty-axis-must-expose-changed-decision","status":"OBSERVED","source_ids":["decision-transforming-difficulty"],"target_ids":["enemy-role-differentiation","rare-variant-rule-mutation","boss-phase-teach-and-recombine"],"relationship":"GATES","conditions":["The baseline and modified rule sets are reproducible.","The changed decision is named and measurable.","Accessibility settings remain independent."],"effect":"A challenge modifier is retained only when comparison shows a new strategic or execution demand rather than duration or punishment alone.","failure_boundary":"If removing the modifier changes only completion time, incoming damage, or enemy health, it has not justified a distinct difficulty axis.","evidence":["https://www.supergiantgames.com/blog/hades-the-nighty-night-update-patch-notes/","https://slayersclub.bethesda.net/en-NZ/article/doom-eternal-master-levels"],"supersedes":null,"updated":"2026-08-11"}
