{"type":"interaction","version":1,"id":"accessibility-channel-substitution-preserves-meaning","status":"OBSERVED","source_ids":["spatial-information-audio","event-bound-feedback-orchestration","world-integrated-interface"],"target_ids":["movement-feedback-stack","enemy-intent-telegraphing","pickup-state-confirmation"],"relationship":"REQUIRES","conditions":["The substituted channel references the same event identity and semantic class.","Timing preserves the original response opportunity.","Assistance discloses any additional information it introduces."],"effect":"Players receive equivalent actionable meaning through supported sensory configurations without changing authority or secretly reducing challenge.","failure_boundary":"A substitute that arrives later, identifies a different target, or adds an undisclosed solution is not semantically equivalent.","evidence":["https://www.playstation.com/en-th/games/the-last-of-us-part-ii/accessibility/"],"supersedes":null,"updated":"2026-08-11"}
