{"type":"interaction","version":1,"id":"journal-preserves-uncertainty","status":"PROVISIONAL","source_ids":["exploration-state-journal"],"target_ids":["learnable-secret-language","knowledge-gated-revisitation"],"relationship":"STRENGTHENS","conditions":["Entries are triggered only by witnessed evidence.","Noticed, inaccessible, resolved, and unknown states remain distinct.","Hints are optional and separate from the record."],"effect":"The player can resume an investigation after interruption without the journal replacing observation or deduction.","failure_boundary":"If the journal names an unseen route, required tool, or solution, persistence has become an answer feed rather than retained player knowledge.","evidence":[],"supersedes":null,"updated":"2026-08-11"}
