{"type":"interaction","version":1,"id":"tension-pacing-balances-exploration","status":"OBSERVED","source_ids":["spatial-landmark-legibility","knowledge-gated-revisitation"],"target_ids":["encounter-pressure-release"],"relationship":"BALANCES","conditions":["Threat intensity varies across rooms and return trips.","Environmental events do not invalidate required clue observation.","Quiet intervals retain uncertainty rather than guaranteeing safety."],"effect":"Pressure makes route choice consequential while release windows permit observation, orientation, and anticipation.","failure_boundary":"Constant pursuit prevents environmental reading; guaranteed empty exploration removes caution; uncontrolled events can conceal or overwrite essential clues.","evidence":["https://www.ea.com/en-gb/inside-ea/news/inside-dead-space-4-the-intensity-director"],"supersedes":null,"updated":"2026-08-11"}
