{"type":"interaction","version":1,"id":"boss-escalation-retains-telegraph-language","status":"OBSERVED","source_ids":["boss-phase-teach-and-recombine"],"target_ids":["enemy-intent-telegraphing","combat-hit-confirmation"],"relationship":"REQUIRES","conditions":["Phase transitions identify the active rule set.","Recombined attacks preserve recognizable anticipation and outcome cues.","New spatial constraints leave a counterable response."],"effect":"Escalation increases execution pressure without converting earlier learning into misinformation.","failure_boundary":"If the same cue changes meaning without instruction or a new attack lands before perception and response are possible, the phase is not a fair recombination.","evidence":["https://slayersclub.bethesda.net/pt-BR/article/doom-eternal-boss-tips"],"supersedes":null,"updated":"2026-08-11"}
