{"type":"interaction","version":1,"id":"presentation-never-creates-authoritative-state","status":"PROVISIONAL","source_ids":["event-bound-feedback-orchestration"],"target_ids":["combat-hit-confirmation","pickup-state-confirmation","collection-ledger-completion"],"relationship":"REQUIRES","conditions":["Every presentation event references an existing authoritative event identity.","Retries and late subscribers are idempotent.","Disabled channels do not change game state."],"effect":"Feedback may describe and emphasize a transition but cannot create damage, ownership, collection credit, or acceptance.","failure_boundary":"If an animation, VFX callback, sound completion, or UI acknowledgement performs the authoritative mutation, presentation loss or replay can corrupt state.","evidence":[],"supersedes":null,"updated":"2026-08-11"}
