{"type":"interaction","version":1,"id":"pickup-confirmation-precedes-ledger-credit","status":"OBSERVED","source_ids":["pickup-state-confirmation"],"target_ids":["collection-ledger-completion"],"relationship":"REQUIRES","conditions":["A collectible has spawned and is eligible.","Ownership and collection progress persist separately."],"effect":"Collection credit follows the authoritative ownership transition and binds the same stable item identity.","failure_boundary":"The relation fails when presentation or ledger completion advances before ownership, duplicates after reload, or points to a different item identity.","evidence":["osrs-collection-reward-analysis"],"supersedes":null,"updated":"2026-08-11"}
