{"type":"interaction","version":1,"id":"save-migration-preserves-earned-state","status":"OBSERVED","source_ids":["versioned-save-migration","death-state-partition"],"target_ids":["collection-ledger-completion","release-evidence-gate"],"relationship":"REQUIRES","conditions":["Every source and target schema has an explicit identity.","Migration runs on a copy and validates earned-state identity before atomic promotion.","Unknown newer, corrupt, and conflicting sources remain readable or recoverable without silent merge."],"effect":"Software and platform changes produce a distinct validated successor while preserving the player-owned parent and declared entitlement boundaries.","failure_boundary":"Any silent loss, duplication, reclassification, overwrite, or account merge breaks continuity even when the resulting file is syntactically valid.","evidence":["https://dev.epicgames.com/documentation/en-us/unreal-engine/versioning-of-assets-and-packages-in-unreal-engine","https://help.bungie.net/hc/articles/360049498031"],"supersedes":null,"updated":"2026-08-11"}
