{"type":"interaction","version":1,"id":"currency-sink-must-change-next-decision","status":"OBSERVED","source_ids":["currency-purpose-and-sinks"],"target_ids":["reward-pool-progression"],"relationship":"STRENGTHENS","conditions":["Currency is earned through repeated activity.","A purchase changes reward access, selection, power, or future earning."],"effect":"Spending converts accumulated value into a visible change in the next reward or activity decision.","failure_boundary":"The interaction fails when spending only clears a cap, buys an equivalent intermediate token, or produces no understandable difference in future choice.","evidence":["destiny-reward-economy-analysis"],"supersedes":null,"updated":"2026-08-11"}
