{"type":"interaction","version":1,"id":"retry-cost-must-not-repeat-solved-content","status":"PROVISIONAL","source_ids":["focused-retry-boundary"],"target_ids":["knowledge-bearing-repetition"],"relationship":"STRENGTHENS","conditions":["The unresolved rule and its dependencies are identified.","Solved sections remain consequential but bounded.","Restored resources preserve the tested decision."],"effect":"Retry time concentrates on learning and execution instead of replaying mastered setup merely to preserve nominal difficulty.","failure_boundary":"If solved content dominates time-to-practice without creating a new decision, the retry boundary is adding duration rather than meaningful consequence.","evidence":[],"supersedes":null,"updated":"2026-08-11"}
