{"type":"interaction","version":1,"id":"shortcut-must-preserve-spatial-model","status":"OBSERVED","source_ids":["knowledge-gated-revisitation"],"target_ids":["spatial-landmark-legibility"],"relationship":"REQUIRES","conditions":["Both ends have stable place identities.","Opening direction and resulting connection are observable.","The shortcut changes traversal cost without silently relocating rooms."],"effect":"The newly opened edge compresses a route while strengthening the player's model of how places connect.","failure_boundary":"A teleport or regenerated connection that cannot be predicted, explained, or recognized may reduce travel time while destroying spatial learning.","evidence":["https://www.ea.com/en-gb/news/inside-dead-space-1-remaking-a-classic","https://www.nintendo.com/us/store/products/the-legend-of-zelda-tears-of-the-kingdom-switch/"],"supersedes":null,"updated":"2026-08-11"}
