{"type":"interaction","version":1,"id":"critical-cue-priority-over-spectacle","status":"OBSERVED","source_ids":["event-bound-feedback-orchestration","adaptive-music-state"],"target_ids":["enemy-intent-telegraphing","combat-hit-confirmation"],"relationship":"GATES","conditions":["Critical cue classes have declared mix and visual priority.","Celebration, music, VFX, camera, and haptics can be independently ducked or interrupted.","The response window remains available after arbitration."],"effect":"Spectacle reinforces impact without hiding the player's next required perception or action.","failure_boundary":"If a reward sting, screen effect, dialogue, or camera response masks a lethal telegraph, presentation has invalidated combat readability.","evidence":["https://www.bungie.net/7/pt-br/News/article/destiny-2-lightfall-music-doc"],"supersedes":null,"updated":"2026-08-11"}
