{"type":"interaction","version":1,"id":"clue-language-gates-secret-discovery","status":"OBSERVED","source_ids":["learnable-secret-language"],"target_ids":["pickup-state-confirmation","collection-ledger-completion"],"relationship":"GATES","conditions":["The anomaly is perceptible before the reward is exposed.","The required interaction follows a previously taught or locally inferable rule.","Discovery and ownership remain separate transitions."],"effect":"The player can attribute the reward to noticing and testing an environmental difference rather than random interaction spam.","failure_boundary":"If collection credit appears before discovery, or no clue distinguishes the secret from ordinary surfaces, the loop does not establish earned exploration.","evidence":["https://play.nintendo.com/news-tips/tips-tricks/scarescraper-tips-and-tricks/"],"supersedes":null,"updated":"2026-08-11"}
